img, holiday
https://media.daysoftheyear.com/20171223112514/step-in-a-puddle-and-splash-your-friends-day-364x242.jpg, Step In A Puddle And Splash Your Friends Day
https://media.daysoftheyear.com/20171223114045/learn-your-name-in-morse-code-day-1-364x242.jpg, Learn Your Name In Morse Code Day
https://media.daysoftheyear.com/20171223115227/milk-day-364x242.jpg, Milk Day
https://media.daysoftheyear.com/20171223114028/be-kind-to-food-servers-month-1-364x242.jpg, Be Kind To Food Servers Month
https://media.daysoftheyear.com/20171223115839/brainteaser-month1-364x242.jpg, Brainteaser Month
https://media.daysoftheyear.com/20171223115855/celebration-of-life-month-1-364x242.jpg, Celebration Of Life Month
https://media.daysoftheyear.com/20171223115951/creativity-month1-364x242.jpg, Creativity Month
https://media.daysoftheyear.com/20171223131700/clean-up-your-computer-month-364x242.jpg, Clean Up Your Computer Month
https://media.daysoftheyear.com/20171223131706/get-a-life-balanced-month-364x242.jpg, Get A Balanced Life Month
https://media.daysoftheyear.com/20171223131710/hobby-month-364x242.jpg, Hobby Month
https://media.daysoftheyear.com/20171223131716/international-brain-teaser-month-364x242.jpg, International Brain Teaser Month
